### ISSUE TITLE
MSUnmerged extremely slow and not completing the whole cleanup cycle

### ISSUE THREAD

**Issue by amaltaro** [dmwm/WMCore#11701]
**Impact of the bug**
MSUnmerged

**Describe the bug**
Without looking into too much details, it's easy to identify that MSUnmerged became very slow and it can potentially take days to clean a single RSE, thus never catching up with the RSE backlog.

Grepping all the 3 instances logs, we can see that for the last 5 days, only one of them managed to go through the full cleanup cycle:
```
$ grep -r 'Total number of RSEs processed' /cephfs/product/dmwm-logs/reqmgr2ms-20230*-ms-unmer-t*
/cephfs/product/dmwm-logs/reqmgr2ms-20230829-ms-unmer-t1-6b6886cf8f-npxxr.log:Total number of RSEs processed: 7.
```

Justas (from Caltech) is especially interested in seeing this being taken care of, as unmerged usage keeps increase. See post in the CMS Talk:
https://cms-talk.web.cern.ch/t/is-unmerged-cleaner-working/28514

**How to reproduce it**
Not sure

**Expected behavior**
We need to investigate and identify why the service became so slow and make sure it is functional again.

If we identify a too complex problem, further github tickets should be created such that we can have effort across the team to resolve it.

**Additional context and error message**
We need to check the logs in vocms0750

**Comment by todor-ivanov** [comment]
Here is a brief report on all my findings. (None of those conclusive, though):
* Upon doubling the pods' resource requirements I can safely tell now we are not hitting any resource limit. But the service is still quite slow:
   * Listing one of the pods details:
```
            "spec": {
                "containers": 
                        "image": "registry.cern.ch/cmsweb/reqmgr2ms-unmerged:2.2.2-stable",
             ...
                        "name": "ms-unmer-t2t3us",
                        "resources": {
                            "limits": {
                                "cpu": "1",
                                "memory": "2Gi"
                            },
                            "requests": {
                                "cpu": "1",
                                "memory": "1Gi"
                            }
                        },
```   
   * While the pod consumes steadily less than half of those:
```
[tivanov@lxplus811 deploymentK8]$ kubectl top pod --containers   ms-unmer-t2t3us-6d5b97b999-r22j9 -n dmwm 
POD                                NAME                       CPU(cores)   MEMORY(bytes)   
ms-unmer-t2t3us-6d5b97b999-r22j9   ms-unmer-t2t3us            142m         423Mi           
ms-unmer-t2t3us-6d5b97b999-r22j9   ms-unmer-t2t3us-filebeat   1m           21Mi            
```

Given that we hit no limits on CPU or Memory... the other two resources left to be checked are I/O and network.  
* Here is the I/O from inside the pod:
```
# sar -b 10 10
Linux 5.16.13-200.fc35.x86_64 (ms-unmer-t2t3us-6d5b97b999-r22j9) 	09/22/23 	_x86_64_	(16 CPU)

19:39:24          tps      rtps      wtps      dtps   bread/s   bwrtn/s   bdscd/s
19:39:34        67.20      0.00     67.20      0.00      0.00   1006.80      0.00
19:39:44        76.50      0.00     76.50      0.00      0.00   1285.60      0.00
19:39:54        26.80      0.00     26.80      0.00      0.00    372.00      0.00
19:40:04        93.50      0.00     93.50      0.00      0.00   1694.70      0.00
19:40:14        77.30      0.00     77.30      0.00      0.00   1472.90      0.00
19:40:24        26.30      0.00     26.30      0.00      0.00    368.60      0.00
19:40:34        80.40      0.00     80.40      0.00      0.00   1593.60      0.00
19:40:44        79.30      0.00     79.30      0.00      0.00   1409.70      0.00
19:40:54        32.40      0.00     32.40      0.00      0.00    533.00      0.00
19:41:04        34.70      0.00     34.70      0.00      0.00    573.10      0.00
Average:        59.44      0.00     59.44      0.00      0.00   1031.00      0.00
```

Looks like the service is not quite heavy on local reads/writes. Then the networking stuff were left as the last resort.... And here I did expect quite a delay, provided we are communicating with the site on a file by file basis for whatever we find to be deleted.


There are few idiosyncrasies here, which I will talk about later, and most of them contribute to the type of traffic we  generate.
* Here are all of the sessions opened from inside the pod  while cleaning one site: T2_US_Florida
```
# netstat -tunap 
Active Internet connections (servers and established)
Proto Recv-Q Send-Q Local Address           Foreign Address         State       PID/Program name    
tcp        0      0 0.0.0.0:8242            0.0.0.0:*               LISTEN      70/python3          
tcp        0      0 127.0.0.1:51548         127.0.0.1:8242          TIME_WAIT   -                   
tcp        0      0 10.100.123.159:52218    188.185.32.60:32002     ESTABLISHED 70/python3          
tcp        0      0 10.100.123.159:44572    188.185.25.144:32003    ESTABLISHED 70/python3          
tcp        0      0 10.100.123.159:44574    188.185.25.144:32003    ESTABLISHED 70/python3          
tcp        0      0 10.100.123.159:52220    188.185.32.60:32002     ESTABLISHED 70/python3          
tcp        0      0 127.0.0.1:51542         127.0.0.1:8242          TIME_WAIT   -                   
tcp        0      0 10.100.123.159:58820    188.184.105.13:32001    ESTABLISHED 70/python3          
tcp        0      0 10.100.123.159:58824    188.184.105.13:32001    ESTABLISHED 70/python3          
tcp        1      0 10.100.123.159:54200    188.185.31.22:80        CLOSE_WAIT  70/python3          
tcp        0      0 10.100.123.159:58822    188.184.105.13:32001    ESTABLISHED 70/python3          
tcp        0   9032 10.100.123.159:55634    128.227.221.222:1094    ESTABLISHED 70/python3          
tcp        0      0 10.100.123.159:35696    128.227.221.219:1094    ESTABLISHED 70/python3          
tcp6       0      0 :::18242                :::*                    LISTEN      87/process_exporter 
tcp6       0      0 10.100.123.159:18242    10.100.156.24:33578     ESTABLISHED 87/process_exporter 

```  
As one can see the only busy connection is through port 1094 (xrootd). 3200* are MongoDB sessions - but we have no read and writes there other than at the beginning of the iteration through an RCE and at the end while recording the results
* Checks with `iptraf`from inside the container:
   * All interfaces statistics 
```
 iptraf-ng 1.2.1
┌ Statistics for eth0 ──────────────────────────────────────────────────────────────────────────────────────────────────────────────────────────────────────────────────────────────────────────────────────────────────────────────────────┐
│                                                                                                                                                                                                                                           │
│               Total      Total    Incoming   Incoming    Outgoing   Outgoing                                                                                                                                                              │
│             Packets      Bytes     Packets      Bytes     Packets      Bytes                                                                                                                                                              │
│ Total:        14562    6458217        6692    2969373        7870    3488844                                                                                                                                                              │
│ IPv4:         14562    6458217        6692    2969373        7870    3488844                                                                                                                                                              │
│ IPv6:             0          0           0          0           0          0                                                                                                                                                              │
│ TCP:          11382    6013335        5102    2644695        6280    3368640                                                                                                                                                              │
│ UDP:           3180     444882        1590     324678        1590     120204                                                                                                                                                              │
│ ICMP:             0          0           0          0           0          0                                                                                                                                                              │
│ Other IP:         0          0           0          0           0          0                                                                                                                                                              │
│ Non-IP:           0          0           0          0           0          0                                                                                                                                                              │
│ Broadcast:        0          0           0          0           0          0                                                                                                                                                              │
│                                                                                                                                                                                                                                           │
│ Total rates:        309.66 kbps            Broadcast rates:        0.00 kbps                                                                                                                                                              │
│                         83 pps                                        0 pps                                                                                                                                                               │
│                                                                                                                                                                                                                                           │
│ Incoming rates:     141.86 kbps                                                                                                                                                                                                           │
│                         38 pps                                                                                                                                                                                                            │
│                                            IP checksum errors:        0                                                                                                                                                                   │
│ Outgoing rates:     167.81 kbps                                                                                                                                                                                                           │
│                         44 pps                                                                                                                                                                                                            │
│                                                                                        
``` 

The traffic is quite low: no more than 200 kbps in one direction 
* All read/writes through the network
```
 iptraf-ng 1.2.1
┌ TCP Connections (Source Host:Port) ────────────────── Packets ────── Bytes  Flag  Iface ────┐
│┌128.227.221.219:rootd                               >       27        9171  -PA-  eth0      │
│└10.100.123.159:35696                                >       36        6165  --A-  eth0      │
│┌127.0.0.1:52138                                     >        1          52  --A-  lo        │
│└127.0.0.1:8242                                      =        0           0  ----  lo        │
│┌10.100.123.159:58822                                >        2         169  --A-  eth0      │
│└188.184.105.13:32001                                >        1         949  -PA-  eth0      │
│┌188.184.105.13:32001                                >        1         948  -PA-  eth0      │
│└10.100.123.159:58820                                >        1          52  --A-  eth0      │
│┌188.185.32.60:32002                                 >        1         924  -PA-  eth0      │
│└10.100.123.159:52218                                >        1          52  --A-  eth0      │
│┌188.185.25.144:32003                                >        1         924  -PA-  eth0      │
│└10.100.123.159:44572                                >        1          52  --A-  eth0      │
└ TCP:      9 entries ─────────────────────────────────────────────────────────────── Active ─┘
┌─────────────────────────────────────────────────────────────────────────────────────────────┐
│ UDP (150 bytes) from 10.254.0.10:domain to 10.100.123.159:50500 on eth0                     │
│ UDP (63 bytes) from 10.100.123.159:56361 to 10.254.0.10:domain on eth0                      │
│ UDP (63 bytes) from 10.100.123.159:56361 to 10.254.0.10:domain on eth0                      │
│ UDP (345 bytes) from 10.254.0.10:domain to 10.100.123.159:56361 on eth0                     │
│ UDP (333 bytes) from 10.254.0.10:domain to 10.100.123.159:56361 on eth0                     │
└ Bottom ────── Time:   0:00 ─────────── Drops:         0 ────────────────────────────────────┘
 Packets captured:                             832   │ TCP flow rate:          8.05 kbps
 Up/Dn/PgUp/PgDn-scroll  M-more TCP info   W-chg actv win  S-sort TCP  X-exit
```
Which confirms my previous observation - active traffic goes only through - 
A) udp for DNS lookup 
B) MongoDB (tcp port 3200*) 
C) xrootd (tcp port 1094) 

All of it in an extremely low rate.


Now lets look at what type of traffic it is - it should consist mostly of queries to the site's  storage for deletions of non existent files, which I expect to be quite small in payload, but to see quite a lot of them. And on top of that I expect to see one DNS lookup for every file deleted:
* Here is a small part of the service log while trying to cleanup one directory with 17K+ files, all of them clearly already missing on the site:
```
2023-09-22 17:32:21,594:DEBUG:MSUnmerged: 
RSE: T2_US_Florida 
DELETING: /store/unmerged/RunIIAutumn18FSPremix/PMSSM_set_2_LL_2_TuneCP2_13TeV-pythia8/AODSIM/GridpackScan_LLPFix_102X_upgrade2018_realistic_v15-v1.
PFN list with: 17901 entries: 
    davs://cmsio2.rc.ufl.edu:1094/store/unmerged/RunIIAutumn18FSPremix/PMSSM_set_2_LL_2_TuneCP2_13TeV-pythia8/AODSIM/GridpackScan_LLPFix_102X_upgrade2018_realistic_v15-v1/2810001/0D22B896-91C3-464D-8233-2FC9120DC255.root
    davs://cmsio2.rc.ufl.edu:1094/store/unmerged/RunIIAutumn18FSPremix/PMSSM_set_2_LL_2_TuneCP2_13TeV-pythia8/AODSIM/GridpackScan_LLPFix_102X_upgrade2018_realistic_v15-v1/2810001/14E93147-B744-BF48-8068-6E379D8A6162.root
    davs://cmsio2.rc.ufl.edu:1094/store/unmerged/RunIIAutumn18FSPremix/PMSSM_set_2_LL_2_TuneCP2_13TeV-pythia8/AODSIM/GridpackScan_LLPFix_102X_upgrade2018_realistic_v15-v1/2810001/16411679-EA7F-1D40-B246-D283A2BF8C7A.root
    davs://cmsio2.rc.ufl.edu:1094/store/unmerged/RunIIAutumn18FSPremix/PMSSM_set_2_LL_2_TuneCP2_13TeV-pythia8/AODSIM/GridpackScan_LLPFix_102X_upgrade2018_realistic_v15-v1/2810001/225D52E4-31A1-A74E-B4CA-DFABE0D36BFB.root
    ...

2023-09-22 17:34:01,838:DEBUG:MSUnmerged: RSE: T2_US_Florida, Dir: /store/unmerged/RunIIAutumn18FSPremix/PMSSM_set_2_LL_2_TuneCP2_13TeV-pythia8/AODSIM/GridpackScan_LLPFix_102X_upgrade2018_realistic_v15-v1, delResult: [GError('DavPosix::unlink  Result HTTP 404 : File not found  after 1 attempts', 2),
 GError('DavPosix::unlink  Result HTTP 404 : File not found  after 1 attempts', 2),
 GError('DavPosix::unlink  Result HTTP 404 : File not found  after 1 attempts', 2),
 GError('DavPosix::unlink  Result HTTP 404 : File not found  after 1 attempts', 2),
 GError('DavPosix::unlink  Result HTTP 404 : File not found  after 1 attempts', 2),

```

* Here is a small excerpt of a tcpdump output for less than a second from inside the pod:
```
20:45:38.210851 eth0  Out IP 10.100.123.159.56461 > 10.254.0.10.53: 47667+ A? cmsio2.rc.ufl.edu.dmwm.svc.cluster.local. (58)
20:45:38.210903 eth0  Out IP 10.100.123.159.56461 > 10.254.0.10.53: 15887+ AAAA? cmsio2.rc.ufl.edu.dmwm.svc.cluster.local. (58)
20:45:38.211048 eth0  In  IP 10.254.0.10.53 > 10.100.123.159.56461: 15887 NXDomain*- 0/1/0 (151)
20:45:38.211084 eth0  In  IP 10.254.0.10.53 > 10.100.123.159.56461: 47667 NXDomain*- 0/1/0 (151)
20:45:38.211137 eth0  Out IP 10.100.123.159.57816 > 10.254.0.10.53: 23059+ A? cmsio2.rc.ufl.edu.svc.cluster.local. (53)
20:45:38.211156 eth0  Out IP 10.100.123.159.57816 > 10.254.0.10.53: 21021+ AAAA? cmsio2.rc.ufl.edu.svc.cluster.local. (53)
20:45:38.211221 eth0  In  IP 10.254.0.10.53 > 10.100.123.159.57816: 21021 NXDomain*- 0/1/0 (146)
20:45:38.211258 eth0  In  IP 10.254.0.10.53 > 10.100.123.159.57816: 23059 NXDomain*- 0/1/0 (146)
20:45:38.211311 eth0  Out IP 10.100.123.159.50302 > 10.254.0.10.53: 25529+ A? cmsio2.rc.ufl.edu.cluster.local. (49)
20:45:38.211338 eth0  Out IP 10.100.123.159.50302 > 10.254.0.10.53: 18855+ AAAA? cmsio2.rc.ufl.edu.cluster.local. (49)
20:45:38.211443 eth0  In  IP 10.254.0.10.53 > 10.100.123.159.50302: 18855 NXDomain*- 0/1/0 (142)
20:45:38.211493 eth0  In  IP 10.254.0.10.53 > 10.100.123.159.50302: 25529 NXDomain*- 0/1/0 (142)
20:45:38.211536 eth0  Out IP 10.100.123.159.55169 > 10.254.0.10.53: 32049+ A? cmsio2.rc.ufl.edu.cern.ch. (43)
20:45:38.211567 eth0  Out IP 10.100.123.159.55169 > 10.254.0.10.53: 42551+ AAAA? cmsio2.rc.ufl.edu.cern.ch. (43)
20:45:38.211613 eth0  In  IP 10.254.0.10.53 > 10.100.123.159.55169: 42551 NXDomain* 0/1/0 (122)
20:45:38.211647 eth0  In  IP 10.254.0.10.53 > 10.100.123.159.55169: 32049 NXDomain* 0/1/0 (122)
20:45:38.211690 eth0  Out IP 10.100.123.159.59238 > 10.254.0.10.53: 61855+ A? cmsio2.rc.ufl.edu. (35)
20:45:38.211708 eth0  Out IP 10.100.123.159.59238 > 10.254.0.10.53: 26265+ AAAA? cmsio2.rc.ufl.edu. (35)
20:45:38.211774 eth0  In  IP 10.254.0.10.53 > 10.100.123.159.59238: 26265* 1/3/4 AAAA 2620:104:1f:1000:faf2:1eff:fed9:dd80 (326)
20:45:38.211810 eth0  In  IP 10.254.0.10.53 > 10.100.123.159.59238: 61855* 1/3/4 A 128.227.221.219 (314)
20:45:38.211968 eth0  Out IP 10.100.123.159.32946 > 128.227.221.219.1094: Flags [S], seq 3185610039, win 64400, options [mss 1400,sackOK,TS val 3813527962 ecr 0,nop,wscale 7], length 0
20:45:38.328060 eth0  In  IP 128.227.221.219.1094 > 10.100.123.159.32946: Flags [S.], seq 2183116857, ack 3185610040, win 26844, options [mss 8960,sackOK,TS val 1395039768 ecr 3813527962,nop,wscale 12], length 0
20:45:38.328084 eth0  Out IP 10.100.123.159.32946 > 128.227.221.219.1094: Flags [.], ack 1, win 504, options [nop,nop,TS val 3813528079 ecr 1395039768], length 0
20:45:38.328390 eth0  Out IP 10.100.123.159.32946 > 128.227.221.219.1094: Flags [P.], seq 1:518, ack 1, win 504, options [nop,nop,TS val 3813528079 ecr 1395039768], length 517
20:45:38.444959 eth0  In  IP 128.227.221.219.1094 > 10.100.123.159.32946: Flags [.], ack 518, win 7, options [nop,nop,TS val 1395039885 ecr 3813528079], length 0
20:45:38.445900 eth0  In  IP 128.227.221.219.1094 > 10.100.123.159.32946: Flags [.], seq 1:2777, ack 518, win 7, options [nop,nop,TS val 1395039886 ecr 3813528079], length 2776
20:45:38.445913 eth0  Out IP 10.100.123.159.32946 > 128.227.221.219.1094: Flags [.], ack 2777, win 497, options [nop,nop,TS val 3813528196 ecr 1395039886], length 0
20:45:38.445904 eth0  In  IP 128.227.221.219.1094 > 10.100.123.159.32946: Flags [P.], seq 2777:4097, ack 518, win 7, options [nop,nop,TS val 1395039886 ecr 3813528079], length 1320
20:45:38.445943 eth0  Out IP 10.100.123.159.32946 > 128.227.221.219.1094: Flags [.], ack 4097, win 491, options [nop,nop,TS val 3813528196 ecr 1395039886], length 0
20:45:38.449797 eth0  In  IP 128.227.221.219.1094 > 10.100.123.159.32946: Flags [P.], seq 4097:5859, ack 518, win 7, options [nop,nop,TS val 1395039890 ecr 3813528079], length 1762
20:45:38.449803 eth0  Out IP 10.100.123.159.32946 > 128.227.221.219.1094: Flags [.], ack 5859, win 497, options [nop,nop,TS val 3813528200 ecr 1395039890], length 0
20:45:38.451310 eth0  Out IP 10.100.123.159.32946 > 128.227.221.219.1094: Flags [P.], seq 518:3294, ack 5859, win 502, options [nop,nop,TS val 3813528202 ecr 1395039890], length 2776
...
```
The DNS lookup  packages are clearly visible on every request for every file ... I haven't put them here all but they repeat at least several time per second. Which is not much at all, but still this is the same query with the same result muhltiple times per second. I may consider installing a local dns cache just for this debugging to eliminate eventual delays coming from the resolver.




 For the amount of files for deletions provided by RucioConMon scans 300Kbs traffic is softly speaking low. Even though most of the times we try to delete nonexistent files, we still need to contact the other end and make a request for deletion and only then we get the result about the missing file. We accumulate so many nonexistent files in those lists because the intervals between the sites scans are quite big - sometimes weeks. On the other hand when we do delete for real, the communication between the site and the service is still not that different but the deletions simply succeed. 

The reasons behind such a low traffic regardless the huge demand could be two:
* Delays on the site's end for implementing the deletion operation
* Traffic limitation on our  side

The former seems less likely, because  we observe this behaviour on every `ms-unmerged` instance with every site. If it were some site peculiarities to play a role here, I'd expect to see some outliers here and there for some of the sites, but the situation seems to be equally bad regardless of the destination. So If we do not heave any type of traffic limitations or degradation on our kuberenetes clusters (or in the underlying infrastructure), then **I am out of ideas** where does this service  wastes cycles and why does it progress so slowly through the lists for deletions 

FYI: @amaltaro @klannon @vkuznet @khurtado

**Comment by todor-ivanov** [comment]
Just a small clarification about:
> we are communicating with the site on a file by file basis for whatever we find to be deleted

This is not exactly true. In MSUnmerged, in the python code, we do accumulate/group all files in batches (of 100 files  currently) and we execute the operation at once. Meaning we send the whole batch to the `gfal` context manager with the `delete` operation. But as far as I remember (and I really hope to be wrong about that) `gfal` still goes to communicate with the endpoint one file at a time.

**Comment by todor-ivanov** [comment]
I must say though - the service may be slow but it is stable. It took 3 days to clean just a single site: T2_US_Florida: [1]
Translated from epoch seconds the the start and end time were as follows:
* startTime: GMT:   Fri 22 Sep 2023 11:13:27 AM GMT
* endTime: GMT:   Mon 25 Sep 2023 03:41:23 AM GMT

[1]
https://cmsweb.cern.ch/ms-unmerged/data/info?rse=T2_US_Florida&detail=False
```
{"result": [
 {
  "wmcore_version": "2.2.2",
  "microservice_version": "2.2.2",
  "microservice": "MSManager",
  "query": "rse=T2_US_Florida&detail=False",
  "rseData": [
    {
      "name": "T2_US_Florida",
      "pfnPrefix": "davs://cmsio2.rc.ufl.edu:1094",
      "rucioConMonStatus": "done",
      "isClean": false,
      "timestamps": {
        "rseConsStatTime": 1694730792.6606388,
        "prevStartTime": 1694843613.3254225,
        "startTime": 1695381207.7534733,
        "prevEndTime": 1693952635.7410872,
        "endTime": 1695613283.8896813
      },
      "counters": {
        "totalNumFiles": 164630,
        "totalNumDirs": 983,
        "dirsToDelete": 903,
        "filesToDelete": 0,
        "filesDeletedSuccess": 49994,
        "filesDeletedFail": 0,
        "dirsDeletedSuccess": 902,
        "dirsDeletedFail": 1,
        "gfalErrors": {
          "No such file or directory": 93893,
          "Host is down": 3
        }
      }
    }
  ]
}]}
```

**Comment by todor-ivanov** [comment]
Right after the the service has cleaned one site it started receiving external restart signals {sig9 and 11):
```
2023-09-25 03:41:23,889:INFO:MSUnmerged: RSE: T2_US_Florida Writing rse data to MongoDB.
2023-09-25 03:41:24,012:DEBUG:MSUnmerged: 
----------------------------------------------------------
MSUnmergedRSE: 
    _id: 620c1b60db2457fa176a369a
    counters: 
        dirsDeletedFail: 1
        dirsDeletedSuccess: 902
        dirsToDelete: 903
        filesDeletedFail: 0
        filesDeletedSuccess: 49994
        filesToDelete: 0
        gfalErrors: 
            Host is down: 3
            No such file or directory: 93893
        totalNumDirs: 983
        ...
----------------------------------------------------------
2023-09-25 03:41:24,024:INFO:MSUnmerged: RSE: T2_US_MIT_Buffer Reading rse data from MongoDB.
2023-09-25 03:41:24,026:WARNING:MSUnmerged: RSE: T2_US_MIT_Buffer Missing in stats records at Rucio Consistency Monitor. Skipping it in the current run.
2023-09-25 03:41:24,026:INFO:MSUnmerged: RSE: T2_US_MIT_Buffer Writing rse data to MongoDB.
2023-09-25 03:41:24,210:WARNING:MSUnmerged: plineUnmerged: Run on RSE: T2_US_MIT_Buffer was interrupted due to: MSUnmergedException: MSUnmergedPlineExit: RSE: T2_US_MIT_Buffer Missing in stats records at Rucio Consistency Monitor. Skipping it in the current run. Will retry again in the next cycle.
2023-09-25 03:41:24,210:INFO:MSUnmerged: RSE: T2_US_Nebraska Reading rse data from MongoDB.
2023-09-25 03:41:24,212:INFO:MSUnmerged: RSE: T2_US_Nebraska With new consistency record in Rucio Consistency Monitor. Resetting RSE and starting a fresh cleanup process in the current run.
2023-09-25 03:41:24,308:DEBUG:RucioConMon: Fetching data from files?rse=T2_US_Nebraska&format=json, with args None
2023-09-25 03:41:24,308:DEBUG:Service: getData: 
        url: files?rse=T2_US_Nebraska&format=json
        verb: GET
        incoming_headers: {}
        data: {}
[25/Sep/2023:03:41:33]  WATCHDOG: server exited with exit code signal 9... restarting

```  

Then again few minutes later: while successfully cleaning stuff at Caltech:
```
[25/Sep/2023:03:42:15] ms-unmer-t2t3us-6d5b97b999-r22j9 127.0.0.1 "GET /ms-unmerged/data/status HTTP/1.1" 200 OK [data: 302 in 105 out 977 us ] [auth: OK "" "" ] [ref: "" "Go-http-client/1.1" ]
2023-09-25 03:42:35,794:DEBUG:MSUnmerged: RSE: T2_US_Caltech, Dir: /store/unmerged/Run3Summer22DRPremix/QCD_PT-800to1000_TuneCP5_13p6TeV_pythia8/AODSIM/124X_mcRun3_2022_realistic_v12_ext1-v2, delResult: [None,
 None,
 None,
 None,
...
[25/Sep/2023:03:45:45] ms-unmer-t2t3us-6d5b97b999-r22j9 127.0.0.1 "GET /ms-unmerged/data/status HTTP/1.1" 200 OK [data: 302 in 105 out 1014 us ] [auth: OK "" "" ] [ref: "" "Go-http-client/1.1" ]
[25/Sep/2023:03:45:49]  WATCHDOG: server exited with exit code signal 11 (core dumped)... restarting
```


Then again few minutes  later while cleaning Wisconsin:
```
[25/Sep/2023:03:49:15] ms-unmer-t2t3us-6d5b97b999-r22j9 127.0.0.1 "GET /ms-unmerged/data/status HTTP/1.1" 200 OK [data: 302 in 105 out 923 us ] [auth: OK "" "" ] [ref: "" "Go-http-client/1.1" ]
2023-09-25 03:49:42,255:DEBUG:MSUnmerged: RSE: T2_US_Wisconsin, Dir: /store/unmerged/Run3Summer22EEMiniAODv3/TTtoLNu2Q_HT-500_NJet-9_TuneCP5_13p6TeV_powheg-pythia8/MINIAODSIM/124X_mcRun3_2022_realistic_postEE_v1-v2, delResult: [None,
 None,
 None,
...
2023-09-25 03:50:12,191:DEBUG:MSUnmerged: RM baseDir: davs://cmsxrootd.hep.wisc.edu:1094/store/unmerged/Run3Summer22EEMiniAODv3/TTtoLNu2Q_HT-500_NJet-9_TuneCP5_13p6TeV_powheg-pythia8/MINIAODSIM/124X_mcRun3_2022_realistic_postEE_v1-v2/2540008/
[25/Sep/2023:03:50:15] ms-unmer-t2t3us-6d5b97b999-r22j9 127.0.0.1 "GET /ms-unmerged/data/status HTTP/1.1" 200 OK [data: 302 in 105 out 906 us ] [auth: OK "" "" ] [ref: "" "Go-http-client/1.1" ]
[25/Sep/2023:03:50:18]  WATCHDOG: server exited with exit code signal 11 (core dumped)... restarting
```

And again few minutes later:
```
...
[25/Sep/2023:03:54:48]  WATCHDOG: server exited with exit code signal 11 (core dumped)... restarting
...
```

And it happened for the last time few second upon the previous restart. And since then it is stable again and is clening MIT currently:
```
[25/Sep/2023:03:54:58]  WATCHDOG: server exited with exit code signal 9... restarting
```
 
If we could check the system logs at the host to see why was the process killed, that would be great.

**Comment by amaltaro** [comment]
@todor-ivanov Todor, thank you for this investigation. Let me make a few observations:
1) `T2_US_MIT_Buffer` should not even show up in the MSUnmerged list of Disk sites. Can you please send a message to the DM team to understand it?
2) signal 9 usually happens when the service is consuming more resources (memory) than expected. Given that it happened while fetching RSE data for `T2_US_Nebraska`, I would suggest you do download the json dump for that RSE and load it in memory to see how far the memory footprint goes.
3) [SO](https://stackoverflow.com/questions/49414841/process-finished-with-exit-code-139-interrupted-by-signal-11-sigsegv) suggests signal 11 to be SIGSEGV. I remember you saying that gfal2 had such issues back in the days of commissioning of this service. Perhaps this is what's happening. But indeed the best would be to confirm it with the host logs.

**Comment by todor-ivanov** [comment]
Thanks for going through all the information provided here @amaltaro. Just a minute ago I created a SNOW ticket to CERNIT and I hope they may have a more direct grasp on the resources we consume and some better ideas  on  checking what limits the service hits such that we do not see the it loading the resources correctly (all of them - CPU, Mem, and Network) and as we expect.

Here is the link: https://cern.service-now.com/service-portal?id=ticket&is_new_order=true&table=incident&sys_id=e3c34d3887697110ad8433340cbb35c1

**Comment by todor-ivanov** [comment]
Hi @amaltaro 
> Given that it happened while fetching RSE data for T2_US_Nebraska

Well it was not exactly the case. It happened only once while loading one of those files. While all other 3 restarts happened during normal work in the middle of the iteration, when all the generators for all the files are supposed to have been already created  in memory... long ago.

**Comment by amaltaro** [comment]
Yes, I believe those are 2 different issues. If Nebraska dump crashes the service, it will keep crashing until we figure this out. Hence it is important to look into that case as well.

**Comment by amaltaro** [comment]
As we plan to complete this issue in the coming days, I am moving it from 2023 Q3 to Q4.

**Comment by todor-ivanov** [comment]
So I finally know the exact culprit for this huge delay in the service. And strangely enough it is the underlying protocol for data transfer. It required  a little bit of coding and hacking in my env, but I finally made a script to measure the runtime  while recursively listing the tree under some branch of the `/store/unmerged/*/*/*` area. And the difference between  running the same operation through `srm` and through `webdav` is hard to ignore. The later is only 4 times slower than the former. And I am quite sure it is not linear because it depends on the contents and on the depth at which we get, and for the current test I used a single directory at `T2_IT_Legnaro` with only `582` entries out of which  only `35` are  `*.root` files and the rest  are empty directories. See the measurements bellow: [1]. And extrapolating this to the whole unmerged area for a site of the size of  `T2_CH_CERN` it simply won't scale.

FYI @amaltaro 

[1]
```
In [1]: dirCont = measureTime(ctx, lfn)
Start _lsTree with protocol: Srm
Base dir pfn: srm://t2-srm-02.lnl.infn.it:8443/srm/managerv2?SFN=/pnfs/lnl.infn.it/data/cms/store/unmerged/GenericNoSmearGEN/InclusiveDileptonMinBias_TuneCP5Plus_13p6TeV_pythia8/GEN/124X_mcRun3_2022_realistic_v12-v2
Elapsed Time Seconds = 45.65931272506714


Start _lsTree with protocol: Davs
Base dir pfn: davs://t2-xrdcms.lnl.infn.it:2880/pnfs/lnl.infn.it/data/cms/store/unmerged/GenericNoSmearGEN/InclusiveDileptonMinBias_TuneCP5Plus_13p6TeV_pythia8/GEN/124X_mcRun3_2022_realistic_v12-v2
Elapsed Time Seconds = 170.47042751312256

In [2]: len(dirCont)
Out[2]: 582
```

**Comment by amaltaro** [comment]
@todor-ivanov are you able to test this same theory in a couple of different sites? Just so we can be sure that this pattern is across sites.

**Comment by todor-ivanov** [comment]
yes I can

**Comment by todor-ivanov** [comment]
And here are the results: 
```
In [19]: dirCont = measureTime(ctx, lfn)
Start _lsTree with protocol: Srm
Base dir pfn: srm://srm.ciemat.es:8443/srm/managerv2?SFN=/pnfs/ciemat.es/data/cms/prod/store/unmerged/GenericNoSmearGEN/InclusiveDileptonMinBias_TuneCP5Plus_13p6TeV_pythia8/GEN/124X_mcRun3_2022_realistic_v12-v1
Elapsed Time Seconds = 65.83919978141785

Start _lsTree with protocol: Davs
Base dir pfn: davs://srm.ciemat.es:2880/pnfs/ciemat.es/data/cms/prod/store/unmerged/GenericNoSmearGEN/InclusiveDileptonMinBias_TuneCP5Plus_13p6TeV_pythia8/GEN/124X_mcRun3_2022_realistic_v12-v1
Elapsed Time Seconds = 184.74907875061035

In [20]: len(dirCont)
Out[20]: 637
```

FYI @amaltaro
